commit_hash,commit_message,throughput_ops_per_sec,node0_ops,node1_ops,node2_ops,node3_ops,timestamp
3ec6c9f,"Initial import.",SKIPPED,SKIPPED,SKIPPED,SKIPPED,SKIPPED,Sun Sep  7 12:04:30 AM MDT 2025
453f229,"Improvements.",9885,9885,,,,Sun Sep  7 12:05:13 AM MDT 2025
909ba05,"fix: YCSB-B was flipping r/w ratio (thanks JJ!)",10200,10200,,,,Sun Sep  7 12:05:55 AM MDT 2025
a5a8a89,"fix: Value not needed in GetRequest",9737,9737,,,,Sun Sep  7 12:06:37 AM MDT 2025
f358a16,"fix: Key not needed in GetResponse.",9867,9867,,,,Sun Sep  7 12:07:20 AM MDT 2025
120ab50,"fix help doc for run-cluster",9900,9900,,,,Sun Sep  7 12:08:01 AM MDT 2025
281a648,"alternate way to get host count",19702,19702,0,0,0,Sun Sep  7 12:09:00 AM MDT 2025
